Why should a Snowflake user configure a secure view? (Choose two.),multi-select,A. To encrypt the data in transit,B. To execute faster than a standard view,C. To protect hidden data from other users,D. To improve the performance of a query,E. To hide the view definition from other users,,,,,,,,,,,"3, 5","CE Some of the internal optimizations for views require access to the underlying data in the base tables for the view. This access might allow data that is hidden from users of the view to be exposed through user code, such as user-defined functions, or other programmatic methods. Secure views do not utilize these optimizations, ensuring that users have no access to the underlying data.  For security or privacy reasons, you might not wish to expose the underlying tables or internal structural details for a view. With secure views, the view definition and details are visible only to authorized users (i.e. users who are granted the role that owns the view).",
Which activities are managed by Snowflake’s Cloud Services layer? (Choose two.),multi-select,A. Authentication,B. Access delegation,C. Data pruning,D. Data compression,E. Query parsing and optimization,,,,,,,,,,,"1, 5",AE correct,
The COPY INTO [location] command can unload data from a table directly into which locations? (Choose two.),multi-select,A. A named internal stage,B. A Snowpipe REST endpoint,C. A network share on a client machine,D. A local directory or folder on a client machine,E. A named external stage that references an external cloud location,,,,,,,,,,,"1, 5","AE is correct  Copy into is possible for  1) Named internal stage (or table/user stage).  2) Named external stage that references an external location (Amazon S3, Google Cloud Storage, or Microsoft Azure). 3) External location https://docs.snowflake.com/en/sql-reference/sql/copy-into-location
AE correct - https://docs.snowflake.com/en/sql-reference/sql/copy-into-location",
What does the Activity area of Snowsight allow users to do? (Choose two.),multi-select,A. Schedule automated data backups.,B. Explore each step of an executed query.,C. Monitor queries executed by users in an account.,D. Create and manage user roles and permissions.,E. Access Snowflake Marketplace to find and integrate datasets.,,,,,,,,,,,"2, 3","BC correct. No longer called Activity, called Monitoring now
BC is correct.  The keyword is activity area!  The Activity area of Snowsight, the Snowflake web interface, lets you:  1)Monitor queries executed by users in your account. 2)View details about queries. 3)View performance data. 4)Explore each step of an executed query. 5)Monitor the status of data loading using COPY INTO (bulk loading) and pipes (continuous loading). 6)View details about instances of bulk and continuous data loading. 7)Navigate to the copy history for individual tables. https://docs.snowflake.com/en/user-guide/ui-snowsight-activity
BC correct   https://docs.snowflake.com/en/user-guide/ui-snowsight-activity https://docs.snowflake.com/en/user-guide/ui-snowsight-quick-tour",
"In which Snowsight section can a user switch roles, modify their profile, and access documentation?",multiple-choice,A. The user menu,B. The activity page,C. The content pane,D. The worksheets page,,,,,,,,,,,,1,"None of them. Account Menu as of 2024-02-14 https://docs.snowflake.com/en/user-guide/ui-snowsight-quick-tour#get-account-information-and-update-your-user-profile-from-the-account-menu
A correct - https://docs.snowflake.com/en/user-guide/ui-snowsight-quick-tour",
What is the recommended way to change the existing file format type in my_format from CSV to JSON?,multiple-choice,A. ALTER FILE FORMAT my_format SET TYPE=JSON;,B. ALTER FILE FORMAT my_format SWAP TYPE WITH JSON;,C. CREATE OR REPLACE FILE FORMAT my_format TYPE=JSON;,D. REPLACE FILE FORMAT my_format TYPE=JSON;,,,,,,,,,,,,3,"C A doesn't work, I tested: --- 803  CREATE FILE FORMAT ET_803 TYPE=CSV;  DESCRIBE FILE FORMAT ET_803;  ALTER FILE FORMAT ET_803 SET TYPE =JSON; ---File format type cannot be changed.  CREATE OR REPLACE FILE FORMAT ET_803 TYPE=JSON;  DESCRIBE FILE FORMAT ET_803;  DROP FILE FORMAT ET_803;
ALTER FILE FORMAT does not support the following actions: - Changing the type (CSV, JSON, etc.) for the file format.  To make any of these changes, you must recreate the file format.
C correct - https://docs.snowflake.com/en/sql-reference/sql/create-file-format",
Which features are included in Snowsight? (Choose two.),multi-select,A. Worksheet sharing,B. Referencing SnowSQL,C. Exploring the Snowflake Marketplace,D. Changing the Snowflake account cloud provider,E. Downloading query result data larger than 100 MB,,,,,,,,,,,"1, 3","AC are for sure possible. E is also possible https://docs.snowflake.com/en/user-guide/ui-snowsight-query To download your query results as a CSV-formatted or TSV-formatted file, select Download results.  The size of your file depends on the amount of data returned by your query. Snowflake does not limit the size of files exported for query results.
AC is correct!
AC correct - https://docs.snowflake.com/en/user-guide/ui-snowsight-quick-tour",
How long can a data consumer who has a pre-signed URL access data files using Snowflake?,multiple-choice,A. Indefinitely,B. Until the result_cache expires,C. Until the retention_time is met,D. Until the expiration_time is exceeded,,,,,,,,,,,,4,"Indefinitely - for file URL Result cache - scoped URL  Pre-signed - ans D
D correct - https://docs.snowflake.com/en/sql-reference/functions/get_presigned_url",
What mechanisms can be used to inform Snowpipe that there are staged files available to load into a Snowflake table? (Choose two.),multi-select,A. Cloud messaging,B. Email integrations,C. Error notifications,D. REST endpoints,E. Snowsight interactions,,,,,,,,,,,"1, 4","answer is AD  as per DOc 1) Automating Snowpipe using cloud messaging 2) Calling Snowpipe REST endpoints
AD correct - https://docs.snowflake.com/en/user-guide/data-load-snowpipe-intro#:~:text=Different%20mechanisms%20for%20detecting%20the%20staged%20files%20are,Snowpipe%20using%20cloud%20messaging%20Calling%20Snowpipe%20REST%20endpoints",
"A Snowflake user needs to import a JSON file larger than 16 MB.

What file format option could be used?",multiple-choice,A. trim_space = true,B. compression = auto,C. strip_outer_array = true,D. strip_outer_array = false,,,,,,,,,,,,3,"C is correct
The correct answer is C.  strip_outer_array = true will remove the outer array structure and copy the file into multiple table rows instead of row. (the limitation for table rows is max 16MB) with this solution it will be fine.  https://docs.snowflake.com/en/user-guide/data-load-considerations-prepare#semi-structured-data-size-limitations
C correct - https://docs.snowflake.com/en/user-guide/data-load-considerations-prepare",
What is a feature of column-level security in Snowflake?,multiple-choice,A. Role access policies,B. Network policies,C. Internal tokenization,D. External tokenization,,,,,,,,,,,,4,"C. Internal tokenization  This feature helps protect sensitive data by replacing it with a token that can only be mapped back to the original data by authorized users or systems.
The correct answer is D. Currently, Column-level Security includes two features:  1)Dynamic Data Masking 2)External Tokenization  https://docs.snowflake.com/user-guide/security-column-intro#what-is-column-level-security
D correct - https://docs.snowflake.com/user-guide/security-column-intro",
Which common query problems can the Query Profile help a user identify and troubleshoot? (Choose two.),multi-select,A. When window functions are used incorrectly,B. When there are exploding joins,C. When there is a UNION without ALL,D. When the SELECT DISTINCT command returns too many values,E. When there are Common Table Expressions (CTEs) without a final SELECT statement,,,,,,,,,,,"2, 3","B - Exploding JOIN well they are almost always bad produces a ton of result records C - UNION without ALL needs extra compute to dedupe the combined results
BC correct - https://www.snowflake.com/blog/new-approaches-visualizing-snowflake-query-statistics/#:~:text=For%20years%2C%20our%20documentation%20has%20helped%20customers%20identify,pruning%20%28most%20often%20evidenced%20by%20large%20table%20scans%29",
What is the Fail-safe retention period for transient and temporary tables?,multiple-choice,A. 0 days,B. 1 day,C. 7 days,D. 90 days,,,,,,,,,,,,1,A correct - https://docs.snowflake.com/en/user-guide/tables-temp-transient,
Which Snowflake features can be enabled by calling the SYSTEM$GLOBAL_ACCOUNT_SET_PARAMETER function by a user with the ORGADMIN role? (Choose two.),multi-select,A. Clustering,B. Client redirect,C. Fail-safe,D. Search optimization service,E. Account and database replication,,,,,,,,,,,"2, 5","BE is correct answer!  https://docs.snowflake.com/en/sql-reference/functions/system_global_account_set_parameter#:~:text=for%20the%20account%3A-,Replication,-Client%20Redirect
BE correct - https://docs.snowflake.com/en/sql-reference/functions/system_global_account_set_parameter",
What are characteristics of directory tables when used with unstructured data? (Choose two.),multi-select,A. Only cloud storage stages support directory tables.,B. Each directory table has grantable privileges of its own.,C. Directory tables store a catalog of staged files in cloud storage.,D. A directory table can be added explicitly to a stage when the stage is created.,E. A directory table is a separate database object that can be layered explicitly on a stage.,,,,,,,,,,,"3, 4","CD is correct!  Directory table: 1- its implicit not separate database object 2 - like external table stores file-level metadata about the data files in the stage 3 - has NO grantable privileges of its own  https://docs.snowflake.com/en/user-guide/data-load-dirtables#what-is-a-directory-table
CD correct - https://docs.snowflake.com/en/user-guide/data-load-dirtables",
Snowflake best practice recommends that which role be used to enforce a network policy on a Snowflake account?,multiple-choice,A. ACCOUNTADMIN,B. SECURITYADMIN,C. SYSADMIN,D. USERADMIN,,,,,,,,,,,,2,B correct - https://docs.snowflake.com/en/sql-reference/sql/create-network-policy,
What is the default behavior of internal stages in Snowflake?,multiple-choice,A. Named internal stages are created by default.,B. Users must manually create their own internal stages.,C. Data files are automatically staged to a default location.,D. Each user and table are automatically allocated an internal stage.,,,,,,,,,,,,4,"Correct answer is D. https://docs.snowflake.com/en/user-guide/data-load-local-file-system-create-stage#types-of-internal-stages
D correct - https://docs.snowflake.com/en/user-guide/data-load-local-file-system-create-stage",
The MAXIMUM size for a serverless task run is equivalent to what size virtual warehouse?,multiple-choice,A. Medium,B. Large,C. 2X-Large,D. 4X-Large,,,,,,,,,,,,3,"The maximum compute size for a serverless task is equivalent to an XXLARGE user-managed virtual warehouse.
C correct - https://docs.snowflake.com/en/user-guide/tasks-intro#:~:text=The%20maximum%20size%20for%20a%20serverless%20task,run%20is%20equivalent%20to%20an%20XXLARGE%20warehouse.",
What storage cost is completely eliminated when a Snowflake table is defined as transient?,multiple-choice,A. Active,B. Fail-safe,C. Staged,D. Time Travel,,,,,,,,,,,,2,B correct - https://docs.snowflake.com/en/user-guide/tables-temp-transient,
How can a Snowflake user traverse semi-structured data?,multiple-choice,A. Insert a colon (:) between the VARIANT column name and any first-level element.,B. Insert a colon (:) between the VARIANT column name and any second-level element.,C. Insert a double colon (::) between the VARIANT column name and any first-level element.,D. Insert a double colon (::) between the VARIANT column name and any second-level element.,,,,,,,,,,,,1,"A : select column:first_level_column from json_table
A correct - https://community.snowflake.com/s/article/querying-semi-structured-data#:~:text=Snowflake%20supports%20SQL%20queries%20that%20access%20semi-structured%20data,as%20the%20path%20delimiter%2C%20i.e.%20the%20form%20table.column%3Apathelement1.pathelement2.pathelement3.",
"Based on Snowflake recommendations, when creating a hierarchy of custom roles, the top-most custom role should be assigned to which role?",multiple-choice,A. ACCOUNTADMIN,B. SECURITYADMIN,C. SYSADMIN,D. USERADMIN,,,,,,,,,,,,3,"https://docs.snowflake.com/en/user-guide/security-access-control-overview#custom-roles  When creating roles that will serve as the owners of securable objects in the system, Snowflake recommends creating a hierarchy of custom roles, with the top-most custom role assigned to the system role SYSADMIN.
correct
correct answer is C https://community.snowflake.com/s/article/Quickly-Visualize-Snowflake-s-Roles-Grants-and-Privileges",
How does Snowflake improve the performance of queries that are designed to filter out a significant amount of data?,multiple-choice,A. The use of indexing,B. The use of pruning,C. The use of TableScan,D. By increasing the number of partitions scanned,,,,,,,,,,,,2,"B : Purring improves query efficiency
B correct",
"A JSON document is stored in the source_column of type VARIANT. The document has an array called elements. The array contains the name key that has a string value.

How can a Snowflake user extract the name from the first element?",multiple-choice,A. source_column.elements[1]:name,B. source_column.elements[0]:name,C. source_column:elements[1].name,D. source_column:elements[0].name,,,,,,,,,,,,4,"D correct
This is not related to the FLATTEN function. This is merely a question on traversing semi-structured datatypes: https://docs.snowflake.com/en/user-guide/querying-semistructured Insert a colon : between the VARIANT column name and any first-level element: <column>:<level1_element>. There are two ways to access elements in a JSON object: Dot Notation Bracket Notation Retrieve a specific numbered instance of a child element in a repeating array by adding a numbered predicate (starting from 0) to the array reference. so the answer is D",
Which function should be used to insert JSON formatted string data into a VARIANT field?,multiple-choice,A. FLATTEN,B. CHECK_JSON,C. PARSE_JSON,D. TO_VARIANT,,,,,,,,,,,,3,"The correct answer is C. PARSE_JSON https://docs.snowflake.com/en/sql-reference/functions/parse_json
correct link - https://docs.snowflake.com/en/sql-reference/functions/parse_json",
Which permission on a Snowflake virtual warehouse allows the role to resize the warehouse?,multiple-choice,A. ALTER,B. MODIFY,C. MONITOR,D. USAGE,,,,,,,,,,,,2,"B is the correct answer!  https://docs.snowflake.com/en/sql-reference/sql/alter-warehouse#access-control-requirements
B correct - https://stackoverflow.com/questions/67444656/how-do-you-restrict-a-warehouse-to-resize-to-role-in-snowflake",
What is it called when a customer managed key is combined with a Snowflake managed key to create a composite key for encryption?,multiple-choice,A. Hierarchical key model,B. Client-side encryption,C. Tri-secret secure encryption,D. Key pair authentication,,,,,,,,,,,,3,"The correct answer is C. https://docs.snowflake.com/en/user-guide/security-encryption-manage
C correct - https://www.phdata.io/blog/encrypting-snowflake-data-with-own-keys/",
"A size 3X-Large multi-cluster warehouse runs one cluster for one full hour and then runs two clusters for the next full hour.

What would be the total number of credits billed?",multiple-choice,A. 64,B. 128,C. 149,D. 192,,,,,,,,,,,,4,"I hope I don't have to calculate this in my head on the exam :)  D XS - S - M - L - XL - 2XL - 3XL 1 - 2 -4 - 8 - 16 - 32 -64 1st hr - 1 2nd hr - 2 64*3 = 192
Correct D - 64 + 128   https://docs.snowflake.com/en/user-guide/warehouses-overview",
What is the impact of increasing the number of concurrent users on a Snowflake virtual warehouse?,multiple-choice,"A. Improved performance for small, simple queries","B. Improved performance for large, complex queries","C. Decreased performance for large, complex queries",D. Decreased consumption of Snowflake credits,,,,,,,,,,,,3,"C correct. Multi-cluster warehouses are best utilized for scaling resources to improve concurrency for users/queries. https://docs.snowflake.com/en/user-guide/warehouses-multicluster#benefits-of-multi-cluster-warehouses
C correct - https://docs.snowflake.com/en/user-guide/warehouses-multicluster#:~:text=As%20the%20number%20of%20concurrent%20user%20sessions%20and%2For,to%20the%20maximum%20number%20defined%20for%20the%20warehouse.",
"By default, how long is the standard retention period for Time Travel across all Snowflake accounts?",multiple-choice,A. 0 days,B. 1 day,C. 7 days,D. 14 days,,,,,,,,,,,,2,"B is correct. The standard retention period is 1 day (24 hours) and is automatically enabled for all Snowflake accounts: For Snowflake Standard Edition, the retention period can be set to 0 (or unset back to the default of 1 day) at the account and object level (i.e. databases, schemas, and tables).
B correct - https://docs.snowflake.com/en/user-guide/data-time-travel",
What type of query will benefit from the query acceleration service?,multiple-choice,A. Queries without filters or aggregation,B. Queries with large scans and selective filters,C. Queries where the GROUP BY has high cardinality,D. Queries of tables that have search optimization service enabled,,,,,,,,,,,,2,"B is correct. Examples of the types of workloads that might benefit from the query acceleration service:  1) Ad hoc analytics. 2) Workloads with unpredictable data volume per query. 3) Queries with large scans and selective filters.  https://docs.snowflake.com/en/user-guide/query-acceleration-service#label-query-acceleration-scale-factor
Answer B is correct  https://docs.snowflake.com/en/user-guide/query-acceleration-service",
How does the search optimization service help Snowflake users improve query performance?,multiple-choice,A. It scans the micro-partitions based on the joins used in the queries and scans only join columns.,B. It maintains a persistent data structure that keeps track of the values of the table’s columns in each of its micro-partitions.,C. It scans the local disk cache to avoid scans on the tables used in the query.,D. It keeps track of running queries and their results and saves those extra scans on the table.,,,,,,,,,,,,2,"B Correct .  To improve performance for point lookups, the search optimization service creates and maintains a persistent data structure called a search access path. The search access path keeps track of which values of the table’s columns might be found in each of its micro-partitions, allowing some to be skipped when scanning the table.  https://docs.snowflake.com/en/user-guide/search-optimization-service#how-does-the-search-optimization-service-work
B correct - https://docs.snowflake.com/en/user-guide/search-optimization-service",
What can be done to reduce queueing on a virtual warehouse?,multiple-choice,A. Increase the AUTO_SUSPEND setting for the warehouse.,B. Change the warehouse to a multi-cluster warehouse.,C. Increase the warehouse size.,D. Lower the MAX_CONCURRENCY_LEVEL setting for the warehouse.,,,,,,,,,,,,2,B correct - https://docs.snowflake.com/en/user-guide/performance-query-warehouse-queue,
What are characteristics of Snowsight worksheets? (Choose two.),multi-select,"A. Worksheets can be grouped under folders, and a folder of folders.",B. Each worksheet is a unique Snowflake session.,C. Users are limited to running only one query on a worksheet.,D. The Snowflake session ends when a user switches worksheets.,E. Users can import worksheets and share them with other users.,,,,,,,,,,,"2, 5","According to documentation:  You can share worksheets and folders of worksheets with other Snowflake users in your account.  Each worksheet is a unique session and can use roles different from the role you select   A is incorrect because you can't nest folders   Thus B&E
AB correct - https://docs.snowflake.com/en/user-guide/ui-snowsight-worksheets",
What are reasons for using the VALIDATE function in Snowflake after a COPY INTO command execution? (Choose two.),multi-select,A. To validate the files that have been loaded earlier using the COPY INTO command,B. To fix errors that were made during the execution of the COPY INTO command,C. To return errors encountered during the execution of the COPY INTO command,D. To identify potential issues in the COPY INTO command before it is executed,E. To count the number of errors encountered during the execution of the COPY INTO command,,,,,,,,,,,"1, 3","AC correct - https://docs.snowflake.com/en/sql-reference/functions/validate
You confused it, the question is about this command and the first sentence says validating files: https://docs.snowflake.com/en/sql-reference/functions/validate",
Which types of URLs are provided by Snowflake to access unstructured data files? (Choose two).,multi-select,A. Absolute URL,B. Dynamic URL,C. File URL,D. Relative URL,E. Scoped URL,,,,,,,,,,,"3, 5","CE is correct.  there are 3 URLs 1-File URL 2-Scoped URL 3-Pre-signed URL https://docs.snowflake.com/en/user-guide/unstructured-intro#types-of-urls-available-to-access-files
CE correct - https://hevodata.com/learn/snowflake-unstructured-data/",
"Which query will return a sample of a table with 1000 rows named testtable, in which each row has a 10% probability of being included in the sample?",multiple-choice,A. select * from testtable sample (0.1);,B. select * from testtable sample (10);,C. select * from testtable sample (0.1 rows);,D. select * from testtable sample (10 rows);,,,,,,,,,,,,2,"B for 10%
B correct - https://docs.snowflake.com/en/sql-reference/constructs/sample",
How can a Snowflake user validate data that is unloaded using the COPY INTO [location] command?,multiple-choice,A. Load the data into a CSV file.,B. Load the data into a relational table.,C. Use the VALIDATION_MODE = SQL statement.,D. Use the VALIDATION_MODE = RETURN_ROWS statement.,,,,,,,,,,,,4,"D is correct Use the VALIDATION_MODE = RETURN_ROWS statement. https://docs.snowflake.com/en/sql-reference/sql/copy-into-location#optional-parameters
D correct - https://community.snowflake.com/s/article/Best-Practices-for-Data-Unloading",
What role in Snowflake separates the management of users and roles from the management of all grants?,multiple-choice,A. ACCOUNTADMIN,B. SYSADMIN,C. SECURITYADMIN,D. USERADMIN,,,,,,,,,,,,4,"USERADMIN
D correct - https://medium.com/snowflake/role-based-access-control-rbac-with-secondary-roles-8ce3c7bb57df",
Which command will unload data from a table into an external stage?,multiple-choice,A. PUT,B. INSERT,C. COPY INTO [location],D. GET,,,,,,,,,,,,3,C correct,
Why is a federated environment used for user authentication in Snowflake?,multiple-choice,A. To enhance data security and privacy,B. To provide real-time monitoring of user activities,C. To separate user authentication from user access,D. To enable direct integration with external databases,,,,,,,,,,,,3,"C is correct  In a federated environment, user authentication is separated from user access.  https://docs.snowflake.com/en/user-guide/admin-security-fed-auth-overview#what-is-a-federated-environment
C correct - https://docs.snowflake.com/en/user-guide/admin-security-fed-auth-overview",
What will happen if a Snowflake user increases the size of a suspended virtual warehouse?,multiple-choice,A. The provisioning of new compute resources for the warehouse will begin immediately.,B. The warehouse will remain suspended but new resources will be added to the query acceleration service.,C. The provisioning of additional compute resources will be in effect when the warehouse is next resumed.,D. The warehouse will resume immediately and start to share the compute load with other running virtual warehouses.,,,,,,,,,,,,3,"C -> Resizing a suspended warehouse does not provision any new compute resources for the warehouse. It simply instructs Snowflake to provision the additional compute resources when the warehouse is next resumed, at which time all the usage and credit rules associated with starting a warehouse apply.
C correct - https://docs.snowflake.com/en/user-guide/warehouses-tasks",
The VALIDATE table function has which parameter as an input argument for a Snowflake user?,multiple-choice,A. LAST_QUERY_ID,B. CURRENT_STATEMENT,C. UUID_STRING,D. JOB_ID,,,,,,,,,,,,4,"D correct. Job_ID which is query ID https://docs.snowflake.com/en/sql-reference/functions/validate#syntax
D correct - https://docs.snowflake.com/en/sql-reference/functions/validate",
"Which Snowflake edition supports Protected Health Information (PHI) data (in accordance with HIPAA and HITRUST CSF regulations), and has a dedicated metadata store and pool of compute resources?",multiple-choice,A. Standard,B. Enterprise,C. Business Critical,D. Virtual Private Snowflake (VPS),,,,,,,,,,,,4,"Only VPS offer such option
C correct - https://docs.snowflake.com/en/user-guide/intro-editions",
Which Snowflake table types are used to manage costs for short-lived tables? (Choose two.),multi-select,A. External tables,B. Permanent tables,C. Shared tables,D. Temporary tables,E. Transient tables,,,,,,,,,,,"4, 5",DE correct - https://docs.snowflake.com/en/user-guide/tables-storage-considerations,
What are key characteristics of virtual warehouses in Snowflake? (Choose two.),multi-select,A. Warehouses that are multi-cluster can have nodes of different sizes.,B. Warehouses can be started and stopped at any time.,"C. Warehouses can be resized at any time, even while running.",D. Warehouses are billed on a per-minute usage basis.,E. Warehouses can only be used for querying and cannot be used for data loading.,,,,,,,,,,,"2, 3","B&C D is incorrect as warehouses are billed on per second basis
BC - correct",
