"How can a user MINIMIZE Continuous Data Protection costs when using large, high-churn, dimension tables?",multiple-choice,A. Create transient tables and periodically copy them to permanent tables.,B. Create temporary tables and periodically copy them to permanent tables.,C. Create regular tables with extended Time Travel and Fail-safe settings.,D. Create regular tables with default Time Travel and Fail-safe settings.,,,,,,,,,,,,1,"A - transient table are basically the same as regular table but do not utilize fail safe hence reducing the storage cost involved with them https://docs.snowflake.com/en/user-guide/tables-temp-transient#transient-tables
For large, high-churn dimension tables that incur overly-excessive CDP costs, the solution is to create these tables as transient with zero Time Travel retention (i.e. DATA_RETENTION_TIME_IN_DAYS=0) and then copy these tables on a periodic basis into a permanent table.
https://docs.snowflake.com/en/user-guide/tables-storage-considerations",
Which Snowsight feature can be used to perform data manipulations and transformations using a programming language?,multiple-choice,A. SnowSQL,B. Dashboards,C. Python worksheets,D. Provider Studio,,,,,,,,,,,,3,"C - SnowSQL is a command line tool and BD makes no sense
It's the only answer",
"In Snowflake's data security framework, how does column-level security contribute to the protection of sensitive information? (Choose two.)",multi-select,A. Implementation of column-level security will optimize query performance.,B. Column-level security supports encryption of the entire database.,C. Column-level security ensures that only the table owner can access the data.,D. Column-level security limits access to specific columns within a table based on user privileges.,E. Column-level security allows the application of a masking policy to a column within a table or view.,,,,,,,,,,,"4, 5",Agree with DE,
How does Snowflake utilize clustering information to improve query performance?,multiple-choice,A. It prunes unnecessary micro-partitions based on clustering metadata.,B. It compresses the data within micro-partitions for faster querying.,C. It automatically allocates additional resources to improve query execution.,D. It organizes clustering information to speed-up data retrieval from storage.,,,,,,,,,,,,1,"A. It prunes unnecessary micro-partitions based on clustering metadata. This accurately describes the core mechanism. By using clustering metadata, Snowflake avoids scanning micro-partitions that do not contain the relevant data, leading to faster query execution.",
How can staged files be removed during data loading once the files have loaded successfully?,multiple-choice,A. Use the DROP command.,B. Use the PURGE copy option.,C. Use the FORCE = TRUE parameter.,D. Use the LOAD_UNCERTAIN_FILES copy option.,,,,,,,,,,,,2,"B - that's what purge does :)
Answer is B",
What objects can be cloned within Snowflake? (Choose two.),multi-select,A. Schemas,B. Users,C. External tables,D. Internal named stages,E. External named stages,,,,,,,,,,,"1, 4","https://docs.snowflake.com/en/user-guide/object-clone#cloning-and-stages
CREATE <object> … CLONE Creates a copy of an existing object in the system. This command is primarily used for creating zero-copy clones of databases, schemas, and tables; however, it can also be used to quickly/easily create clones of other schema objects , such as external stages, file formats, and sequences, and database roles.  https://docs.snowflake.com/en/user-guide/object-clone",
What can be used to process unstructured data?,multiple-choice,A. External tables,B. The COPY INTO [table] command,C. External functions,D. Snowpipe,,,,,,,,,,,,1,"C is the correct answer
C is correct
External functions allow you to call external services/APIs to process unstructured data Useful for tasks like text analysis, image processing, or other complex transformations",
Which type of workload is recommended for Snowpark-optimized virtual warehouses?,multiple-choice,A. Workloads with ad hoc analytics,B. Workloads that have large memory requirements,C. Workloads with unpredictable data volumes for each query,D. Workloads that are queried with small table scans and selective filters,,,,,,,,,,,,2,"https://docs.snowflake.com/en/user-guide/warehouses-snowpark-optimized#when-to-use-a-snowpark-optimized-warehouse
B is the right answer",
What is the benefit of using the STRIP_OUTER_ARRAY parameter with the COPY INTO [table] command when loading data from a JSON file into a table?,multiple-choice,A. It flattens multiple arrays into a single array.,B. It removes the outer array structure and loads separate rows of data.,C. It transforms a pivoted table into an array.,D. It tokenizes each data string using the defined delimiters.,,,,,,,,,,,,2,,
"A query containing a WHERE clause is running longer than expected. The Query Profile shows that all micro-partitions being scanned.

How should this query be optimized?",multiple-choice,A. Create a view on the table.,B. Add a clustering key to the table.,C. Add a LIMIT clause to the query.,D. Add a Dynamic Data Masking policy to the table.,,,,,,,,,,,,2,"Adding a clustering key would improve the depth and, in turn, pruning efficiency.",
Which access control entity in Snowflake can be created as part of a hierarchy within an account?,multiple-choice,A. Securable object,B. Role,C. Privilege,D. User,,,,,,,,,,,,2,B role is hierarchic,
"When an object is created in Snowflake, who owns the object?",multiple-choice,A. The public role,B. The user's default role,C. The current active primary role,D. The owner of the parent schema,,,,,,,,,,,,3,,
What is the MINIMUM Snowflake edition that must be used in order to see the ACCESS_HISTORY view?,multiple-choice,A. Standard,B. Enterprise,C. Business Critical,D. Virtual Private Snowflake (VPS),,,,,,,,,,,,2,"Agree with B
Access History requires Enterprise Edition (or higher). To inquire about upgrading, please contact Snowflake Support. This Account Usage view can be used to query the access history of Snowflake objects (e.g. table, view, column) within the last 365 days (1 year).",
Which role is responsible for managing the billing and credit data within Snowflake?,multiple-choice,A. ORGADMIN,B. ACCOUNTADMIN,C. SYSADMIN,D. SECURITYADMIN,,,,,,,,,,,,2,"https://docs.snowflake.com/en/user-guide/security-access-control-considerations#using-the-accountadmin-role
The account administrator (i.e users with the ACCOUNTADMIN system role) role is the most powerful role in the system. This role alone is responsible for configuring parameters at the account level. Users with the ACCOUNTADMIN role can view and manage Snowflake billing and credit data, and can stop any running SQL statements.",
"What can be used to identify the database, schema, stage, and file path to a set of files, and to allow a role that has sufficient privileges on the stage to access the files?",multiple-choice,A. A scoped URL,B. A file URL,C. A pre-signed URL,D. A directory table,,,,,,,,,,,,2,"https://docs.snowflake.com/en/user-guide/unstructured-intro
It's B, File URL : URL that identifies the database, schema, stage, and file path to a set of files. A role that has sufficient privileges on the stage can access the files",
Which command is used to remove files from either external cloud storage or an internal stage?,multiple-choice,A. DELETE,B. REMOVE,C. TRUNCATE,D. DROP,,,,,,,,,,,,2,B. REMOVE Removes files from either an external (external cloud storage) or internal (i.e. Snowflake) stage. https://docs.snowflake.com/en/sql-reference/sql/remove,
"How does Snowflake recommend defining a clustering key on a high-cardinality column that includes a 15 digit ID numbered column, ID_NUMBER?",multiple-choice,"A. TRUNC(ID_NUMBER, -6)","B. TRUNC(ID_NUMBER, 5)",C. ID_NUMBER*100,D. TO_CHAR(ID_NUMBER),,,,,,,,,,,,1,"A - Using Trunc(ID_NUMBER, -6) we reduce the cardinality of the column by turning the last 6 digits of the ID to zeros https://docs.snowflake.com/fr/sql-reference/functions/trunc",
Which query types will have significant performance improvement when run using the search optimization service? (Choose two.),multi-select,A. Range searches,B. Equality searches,C. Substring searches,D. Queries with IN predicates,E. Queries with aggregation,,,,,,,,,,,"2, 4","Point lookup queries are queries that are expected to return a small number of rows. The search optimization service can improve the performance of point lookup queries that use:  Equality predicates (for example, <column_name> = <constant>).  Predicates that use IN (see example).  Example
B and D
https://docs.snowflake.com/en/user-guide/search-optimization/point-lookup-queries",
Which Query Profile operator is considered a DML operator?,multiple-choice,A. ExternalScan,B. Flatten,C. Merge,D. Sort,,,,,,,,,,,,3,"https://docs.snowflake.com/en/user-guide/ui-snowsight-activity#dml-operators
Insert, Delete, Update, MERGE, and Unload are DML Operator",
Masking policies are created at what level in Snowflake?,multiple-choice,A. Table,B. Column,C. Schema,D. Database,,,,,,,,,,,,3,"https://docs.snowflake.com/en/sql-reference/sql/create-masking-policy
Masking policies are applied to columns to control how sensitive data is displayed
C. schema https://docs.snowflake.com/en/user-guide/security-column-intro  ""What are masking policies? Snowflake supports masking policies as a schema-level object to protect sensitive data....""",
What would cause different results to be returned when running the same query twice?,multiple-choice,A. SAMPLE is used and the seed is set.,B. SAMPLE is used and the seed is not set.,C. Fraction-based sampling is used.,D. Fixed-size sampling is used.,,,,,,,,,,,,2,,
What are type predicates used for?,multiple-choice,A. Extracting data from a VARIANT column,B. Casting a value in a VARIANT column to a particular data type,C. Determining if a value in a VARIANT column is a particular data type,D. Manipulating objects and arrays in a VARIANT column,,,,,,,,,,,,3,"https://docs.snowflake.com/en/sql-reference/functions/is
Type predicates are functions like IS_BOOLEAN, IS_BINARY, etc... They check the type of values in variants  See https://docs.snowflake.com/en/sql-reference/functions-semistructured#list-of-semi-structured-and-structured-data-functions",
Which table function is used to perform additional processing on the results of a previously-run query?,multiple-choice,A. QUERY_HISTORY,B. RESULT_SCAN,C. DESCRIBE_RESULTS,D. QUERY_HISTORY_BY_SESSION,,,,,,,,,,,,2,https://docs.snowflake.com/en/sql-reference/functions/result_scan,
Which actions can be performed using a resource monitor in Snowflake? (Choose two.),multi-select,A. Monitor the performance of individual queries in real-time.,B. Automatically allocate more storage space to a virtual warehouse.,C. Modify the queries being executed within a virtual warehouse.,D. Suspend a virtual warehouse when its credit usage reaches a defined limit.,E. Trigger a notification to account administrators when credit usage reaches a specified threshold.,,,,,,,,,,,"4, 5",D & E options are correct.,
Which Snowflake native tool can be used to diagnose and troubleshoot network connections?,multiple-choice,A. SnowSQL,B. Snowflake Python connector,C. Snowsight,D. SnowCD,,,,,,,,,,,,4,"D. It is litterally the definition of the tool https://docs.snowflake.com/en/user-guide/snowcd
SnowCD
SnowCD is D, not C.",
Why would a Snowflake user load JSON data into a VARIANT column instead of a string column?,multiple-choice,A. A VARIANT column is more secure than a string column.,B. A VARIANT column compresses data and a string column does not.,C. A VARIANT column can be used to create a data hierarchy and a string column cannot.,D. A VARIANT column will have a better query performance than a string column.,,,,,,,,,,,,3,https://docs.snowflake.com/en/user-guide/semistructured-considerations,
How can a 5 GB table be downloaded into a single file MOST efficiently?,multiple-choice,A. Keep the default MAX_FILE_SIZE to 16 MB.,B. Set the default MAX_FILE_SIZE to 5 GB.,C. Set the SINGLE parameter to TRUE.,D. Use a regular expression in the stage specifications of the COPY command.,,,,,,,,,,,,3,,
Which security models are used in Snowflake to manage access control? (Choose two.),multi-select,A. Discretionary Access Control (DAC),B. Identity Access Management (IAM),C. Mandatory Access Control (MAC),D. Role-Based Access Control (RBAC),E. Security Assertion Markup Language (SAML),,,,,,,,,,,"1, 4","https://docs.snowflake.com/en/user-guide/security-access-control-overview  Snowflake’s approach to access control combines aspects from the following models:  Discretionary Access Control (DAC): Each object has an owner, who can in turn grant access to that object.  Role-based Access Control (RBAC): Access privileges are assigned to roles, which are in turn assigned to users.  User-based Access Control (UBAC): Access privileges are assigned directly to users. Access control considers privileges assigned directly to users only when USE SECONDARY ROLE is set to ALL.
It's the same response from Gemini, GPT and Claude ;-)  Be careful, because they often give different answers. They fail a lot of these tests",
Which Snowflake governance feature allows users to assign metadata labels to improve data governance and database access control?,multiple-choice,A. Secure functions,B. Secure views,C. Object tagging,D. Row-level security,,,,,,,,,,,,3,https://docs.snowflake.com/en/user-guide/object-tagging,
What is the MINIMUM Snowflake edition that supports database replication?,multiple-choice,A. Standard,B. Enterprise,C. Business Critical,D. Virtual Private Snowflake (VPS),,,,,,,,,,,,1,"A - Every edition supports features like database replication and time travel
Database replication is supported on all editions, so it's A
https://docs.snowflake.com/en/user-guide/db-replication-intro",
"Which Snowflake function and command combination should be used to convert rows in a relational table to a single VARIANT column, and unload the rows into a file in JSON format? (Choose two.)",multi-select,A. PUT,B. GET,C. COPY,D. EXPORT,E. OBJECT_CONSTRUCT,,,,,,,,,,,"3, 5",CE - seen this question multiple times,
What Snowflake recommendation is designed to ensure that staged data is only loaded once?,multiple-choice,A. Partitioning staged data files,B. Loading only the most recently-staged data files,C. Removing data files after loading,D. Identifying and removing duplicates after each data load,,,,,,,,,,,,3,,
Which privilege grants the ability to set a column-level security masking policy on a table or view column?,multiple-choice,A. APPLY,B. CREATE,C. SET,D. MODIFY,,,,,,,,,,,,1,"https://docs.snowflake.com/en/user-guide/security-column-ddm-intro#dynamic-data-masking-privileges
Go to section Masking policy privileges.  APPLY >>>Enables executing the unset and set operations for a masking policy on a column.  Correct answer- Apply",
"When sharing data in Snowflake, what privileges does a Provider need to grant along with a share? (Choose two.)",multi-select,A. USAGE on the specific tables in the database.,B. MODIFY on the specific tables in the database.,C. SELECT on the specific tables in the database.,D. USAGE on the database and the schema containing the tables to share.,E. OPERATE on the database and the schema containing the tables to share.,,,,,,,,,,,"3, 4","https://docs.snowflake.com/en/user-guide/data-sharing-gs#grant-database-roles-to-a-share
GRANT USAGE ON DATABASE sales_db TO SHARE sales_s; GRANT USAGE ON SCHEMA sales_db.aggregates_eula TO SHARE sales_s;  GRANT SELECT ON TABLE sales_db.aggregates_eula.aggregate_1 TO SHARE sales_s;",
How can the Query Profile be used to troubleshoot a problematic query?,multiple-choice,A. It will indicate if a virtual warehouse memory is too small to run the query.,B. It will indicate if a user lacks the privileges needed to run the query.,C. It will indicate if a virtual warehouse is in auto-scale mode.,D. It will indicate if the user has enough Snowflake credits to run the query.,,,,,,,,,,,,1,,
Which data type can be used for floating-point numbers without losing precision?,multiple-choice,A. BINARY,B. VARIANT,C. INTEGER,D. DOUBLE,,,,,,,,,,,,4,"D is correct DOUBLE is a synonim for FLOAT in data types
https://docs.snowflake.com/en/sql-reference/data-types-numeric",
Which data sharing option allows a Snowflake user to set up and manage a group of accounts and offer a share to that group?,multiple-choice,A. Free listing,B. Paid listing,C. Direct share,D. Data Exchange,,,,,,,,,,,,4,"With a Data Exchange, you can: Create a group of accounts Manage access to this group Offer data shares to the entire group",
What kind of authentication do Snowpipe REST endpoints use?,multiple-choice,A. OAuth,B. Key-based,C. Username and password,D. Single Sign-On (SSO),,,,,,,,,,,,2,,
What are the possible values within a METADATA$ACTION column in a Snowflake stream? (Choose two.),multi-select,A. INSERT,B. UPDATE,C. DELETE,D. TRUNCATE,E. UPSERT,,,,,,,,,,,"1, 3","AC - INSERT and DELETE
INSERT and DELETE
Insert and delete. https://docs.snowflake.com/en/user-guide/streams-intro#:~:text=following%20additional%20columns%3A-,METADATA%24ACTION,-Indicates%20the%20DML",
"What is the MINIMUM Snowflake edition that offers data protection for extremely sensitive data, such as Protected Health Information (PHI)?",multiple-choice,A. Standard,B. Enterprise,C. Business Critical,D. Virtual Private Snowflake (VPS),,,,,,,,,,,,3,"Poorly phrased question... what's the use of adding (PHI) at the end except to spread confusion ? but answer is C
Business Critical Edition, formerly known as Enterprise for Sensitive Data (ESD), offers even higher levels of data protection to support the needs of organizations with extremely sensitive data, particularly PHI data that must comply with HIPAA and HITRUST CSF regulations.",
"What takes the highest precedence in Snowflake file format options, when specified in multiple locations during data loading?",multiple-choice,A. The stage definition,B. The table definition,C. The use of a COPY INTO [table] statement,D. The use of a COPY INTO [location] statement,,,,,,,,,,,,2,"Table has not relevance here.
D :https://docs.snowflake.com/en/sql-reference/functions/validate#:~:text=Validates%20the%20files%20loaded%20in,than%20just%20the%20first%20error.",
Which service or tool is a Command Line Interface (CLI) client used for connecting to Snowflake to execute SQL queries?,multiple-choice,A. Snowsight,B. SnowCD,C. Snowpark,D. SnowSQL,,,,,,,,,,,,4,"correct
SnowSQL D",
What Snowflake objects can contain custom application logic written in JavaScript? (Choose two.),multi-select,A. Stored procedures,B. Stages,C. Tasks,D. Views,E. User-Defined Functions (UDFs),,,,,,,,,,,"1, 5",correct,
What is the MINIMUM Snowflake edition required to use the column-level security feature?,multiple-choice,A. Standard,B. Enterprise,C. Business Critical,D. Virtual Private Snowflake (VPS),,,,,,,,,,,,2,"https://docs.snowflake.com/en/user-guide/intro-editions
This feature requires Enterprise Edition (or higher). To inquire about upgrading, please contact Snowflake Support. https://docs.snowflake.com/en/user-guide/security-column-intro
C. Business Critical  Explanation: Column-level security in Snowflake, such as column masking policies, is available starting from the Business Critical edition, providing more granular control over data access.  Why the others are wrong:   A. Standard: The Standard edition does not support column-level security features.  B. Enterprise: Although the Enterprise edition includes many features, column-level security is not available in this edition.  D. Virtual Private Snowflake (VPS): While VPS includes enhanced security features, it is not the minimum edition for column-level security.",
Which command should be used to assign a key to a Snowflake user who needs to connect using key pair authentication?,multiple-choice,A. ALTER USER jsmith SET RSA_P8_KEY='MIIBIjANBgkqh...';,B. ALTER USER jsmith SET ENCRYPTED_KEY='MIIBIjANBgkqh...';,C. ALTER USER jsmith SET RSA_PRIVATE_KEY='MIIBIjANBgkqh...';,D. ALTER USER jsmith SET RSA_PUBLIC_KEY='MIIBIjANBgkqh...';,,,,,,,,,,,,4,"D, key needs to be public
Correct Answer D https://docs.snowflake.com/en/user-guide/key-pair-auth Go to section Assign the public key to a Snowflake user of above url.",
What optional properties can a Snowflake user set when creating a virtual warehouse? (Choose two.),multi-select,A. Auto-suspend,B. Cache size,C. Default role,D. Resource monitor,E. Storage size,,,,,,,,,,,"1, 4","https://docs.snowflake.com/en/sql-reference/sql/create-warehouse
Based on this it looks correct - https://docs.snowflake.com/en/sql-reference/sql/create-warehouse",
What is the purpose of the use of the VALIDATE command?,multiple-choice,A. To view any queries that encountered an error,B. To verify that a SELECT query will run without error,C. To prevent a PUT statement from running if an error occurs,D. To see all errors from a previously run COPY INTO [table] statement,,,,,,,,,,,,4,"https://docs.snowflake.com/en/sql-reference/functions/validate
D - that's the purpose of VALIDATE no further explanation needed
https://docs.snowflake.com/en/sql-reference/functions/validate
VALIDATE - Validates the files loaded in a past execution of the COPY INTO command - Returns all the errors encountered during the load, rather than just the first error",
Which function is used to unload a relational table into a JSON file?,multiple-choice,A. PARSE_JSON,B. JSON_EXTRACT_PATH_TEXT,C. OBJECT_CONSTRUCT,D. TO_JSON,,,,,,,,,,,,4,"The TO_JSON function in Snowflake is used to convert relational data into a JSON-formatted string. It is the appropriate function to use when unloading a relational table into a JSON file, as it serializes the data into a JSON representation.
D is correct, I think the first two are for unloading json and C needs the COPY INTO [location] to successfully unload json",
How can the ACCESS_HISTORY view in the ACCOUNT_USAGE schema be used to review the data governance settings for an account? (Choose two.),multi-select,A. Identify queries run by a particular user.,B. Identify access to the roles given to a user.,C. Identify SQL statements that failed to run.,D. Identify objects that were modified by a query.,E. Identify object dependencies.,,,,,,,,,,,"1, 4",,
Which command is used to unload data from a Snowflake table into a Snowflake stage?,multiple-choice,A. GET,B. CREATE STAGE,C. COPY INTO [location],D. PUT,,,,,,,,,,,,3,"C is correct
correct
Option : C -- is correct",
"What should an account administrator do to help a user log into Snowflake, if the user cannot authenticate using Multi-Factor Authentication (MFA)?",multiple-choice,A. Set DISABLE_MFA to TRUE for the user.,B. Set MINS_TO_BYPASS_MFA equal to 0 for the user.,C. Set ALLOW_ID_TOKEN to FALSE for the user.,D. Set ALLOW_CLIENT_MFA_CACHING to FALSE for the user.,,,,,,,,,,,,1,The adiminstrator should disable the MFA for the user.,
Which command can be executed from a reader account?,multiple-choice,A. INSERT,B. CREATE SHARE,C. SHOW PROCEDURES,D. COPY INTO [location],,,,,,,,,,,,4,"""However, you can use the COPY INTO <location> command with your connection credentials to unload data into a cloud storage location.  Additionally, you cannot execute the following commands in a reader account: INSERT UPDATE DELETE MERGE CREATE IMAGE REPOSITORY COPY INTO <table> CREATE MASKING POLICY CREATE PIPE CREATE ROW ACCESS POLICY CREATE SERVICE CREATE SHARE CREATE STAGE SHOW PROCEDURES""  https://docs.snowflake.com/en/user-guide/data-sharing-reader-create
None if these can be executed according to docs",
Which command line parameter value can be pre-specified as an environment variable in SnowSQL?,multiple-choice,A. HOST,B. VARIABLE,C. OPTION,D. MFA-PASSCODE,,,,,,,,,,,,1,"""Currently, environment variables can only be used to pre-specify some command line parameter values such as password, host, and database""  https://docs.snowflake.com/en/user-guide/snowsql-start#:~:text=Currently%2C%20environment%20variables%20can%20only%20be%20used%20to%20pre%2Dspecify%20some%20command%20line%20parameter%20values%20such%20as%20password%2C%20host%2C%20and%20database",
Which command is used to determine the file name of each row of data from a staged file?,multiple-choice,A. SHOW FILE FORMATS,B. SELECT METADATA$FILE_CONTENT_KEY,C. SELECT METADATA$FILE_ROW_NUMBER,D. SELECT METADATA$FILENAME,,,,,,,,,,,,4,https://docs.snowflake.com/en/user-guide/querying-metadata,
Which Snowflake feature improves the performance of point lookup queries?,multiple-choice,A. Materialized views,B. Automatic clustering,C. Query acceleration service,D. Search optimization service,,,,,,,,,,,,4,correct,
What is the impact of selecting one Snowflake edition over another? (Choose two.),multi-select,A. The edition will impact the unit costs for storage.,B. The edition will impact which regions can be accessed by the accounts.,C. The edition will determine the unit costs for the compute credits.,D. The edition will impact the total allowed storage space.,E. The edition will set a limit on the number of compute credits that can be consumed.,,,,,,,,,,,"1, 3","AC - unit costs and compute credits
Yes, finally 1167 question finshedcongrats!!! Don't know how many times I Need to go though 1167 question before exam.
https://docs.snowflake.com/en/user-guide/intro-editions",
"In a managed access schema, only the schema owner or a role with what privilege can help centralize privilege management?",multiple-choice,A. USAGE,B. OPERATE,C. MANAGE GRANTS,D. IMPORTED PRIVILEGES,,,,,,,,,,,,3,,
Which command should be used to drop files from an internal or external stage?,multiple-choice,A. DELETE,B. DROP,C. REMOVE,D. TRUNCATE,,,,,,,,,,,,3,correct,
