Question,Question Type (multiple-choice or multi-select),Answer Option 1,Answer Option 2,Answer Option 3,Answer Option 4,Answer Option 5,Answer Option 6,Answer Option 7,Answer Option 8,Answer Option 9,Answer Option 10,Answer Option 11,Answer Option 12,Answer Option 13,Answer Option 14,Answer Option 15,Correct Response,Explanation,Knowledge Area
Snowflake provides a mechanism for its customers to override its natural clustering algorithms. This method is:,multiple-choice,A. Micro-partitions,B. Clustering keys,C. Key partitions,D. Clustered partitions,,,,,,,,,,,,2,"A company's security audit requires generating a report listing all Snowflake logins (e.g.. date and user) within the last 90 days.
https://community.snowflake.com/s/article/Snowflake-What-the-Cluster",
Which of the following are valid Snowflake Virtual Warehouse Scaling Policies? (Choose two.),multi-select,A. Custom,B. Economy,C. Optimized,D. Standard,,,,,,,,,,,,"2, 4","Answer is B/D.    objectProperties ::=  WAREHOUSE_SIZE = XSMALL | SMALL | MEDIUM | LARGE | XLARGE | XXLARGE | XXXLARGE | X4LARGE | X5LARGE | X6LARGE  MAX_CLUSTER_COUNT = <num>  MIN_CLUSTER_COUNT = <num>  SCALING_POLICY = STANDARD | ECONOMY  AUTO_SUSPEND = <num> | NULL  AUTO_RESUME = TRUE | FALSE  INITIALLY_SUSPENDED = TRUE | FALSE  RESOURCE_MONITOR = <monitor_name>  COMMENT = '<string_literal>'
https://community.snowflake.com/s/article/Snowflake-Visualizing-Warehouse-Performance",
True or False: A single database can exist in more than one Snowflake account.,multiple-choice,A. True,B. False,,,,,,,,,,,,,,1,"The question is where the single database (instance) can exist across multiple accounts. Replication creates a separate instance and keeps it in sync with primary DB, but the DB instance can only belong to one account. Its a tricky question
Through database replication, should be A https://docs.snowflake.com/en/user-guide/database-replication-intro.html",
Which of the following roles is recommended to be used to create and manage users and roles?,multiple-choice,A. SYSADMIN,B. SECURITYADMIN,C. PUBLIC,D. ACCOUNTADMIN,,,,,,,,,,,,2,"Here the answer should be SECURITYADMIN as it is parent of USERADMIN (which is the correct answer)  More details: https://docs.snowflake.com/en/user-guide/security-access-control-considerations  Attention  By default, when your account is provisioned, the first user is assigned the ACCOUNTADMIN role. This user should then create one or more additional users who are assigned the USERADMIN role. All remaining users should be created by the user(s) with the USERADMIN role or another role that is granted the global CREATE USER privilege.",
True or False: Bulk unloading of data from Snowflake supports the use of a SELECT statement.,multiple-choice,A. True,B. False,,,,,,,,,,,,,,2,"B UNLOAD INTO @stage_name/files FROM my_table FILE_FORMAT = (TYPE = 'CSV');
",
Select the different types of Internal Stages: (Choose three.),multi-select,A. Named Stage,B. User Stage,C. Table Stage,D. Schema Stage,,,,,,,,,,,,"1, 2, 3","ABC is the correct answer
ABC https://docs.snowflake.com/en/user-guide/data-load-local-file-system-create-stage.html",
True or False: A customer using SnowSQL / native connectors will be unable to also use the Snowflake Web Interface (UI) unless access to the UI is explicitly granted by support.,multiple-choice,A. True,B. False,,,,,,,,,,,,,,2,"WebUI and SnowSQL are available for all users. Answer is FALSE
https://docs.snowflake.com/en/user-guide/connecting.html",
Account-level storage usage can be monitored via:,multiple-choice,A. The Snowflake Web Interface (UI) in the Databases section,B. The Snowflake Web Interface (UI) in the Account -> Billing & Usage section,C. The Information Schema -> ACCOUNT_USAGE_HISTORY View,D. The Account Usage Schema -> ACCOUNT_USAGE_METRICS View,,,,,,,,,,,,2,"B is correct. for D it should be TABLE_STORAGE_METRICS not ACCOUNT_USAGE_METRICS. there is no view with account_usage_metrics name. if D has said view name is TABLE_STORAGE_METRICS then its correct
https://docs.snowflake.com/en/user-guide/admin-usage-billing.html",
Credit Consumption by the Compute Layer (Virtual Warehouses) is based on: (Choose two.),multi-select,A. Number of users,B. Warehouse size,C. Amount of data processed,D. # of clusters for the Warehouse,,,,,,,,,,,,"2, 3","B. Warehouse size: The size of the virtual warehouse is one of the primary factors that determine the credit consumption. Larger warehouses have more compute resources available, which allows them to process data faster and more efficiently, but also results in higher credit consumption.  C. Amount of data processed: The amount of data processed by the virtual warehouse is another key factor that determines credit consumption. Snowflake charges credits based on the amount of data processed, regardless of the number of users or the number of clusters used by the virtual warehouse.  A. Number of users and D. # of clusters for the warehouse are not direct factors in credit consumption by the compute layer. However, the number of users and the number of clusters used can indirectly affect credit consumption by impacting the amount of data processed and the warehouse size required to process that data efficiently.  Therefore, the credit consumption by the compute layer in Snowflake is primarily based on warehouse size and the amount of data processed.
B & C, Snowflake credits are charged based on the number of virtual warehouses you use, how long they run, and their size. https://docs.snowflake.com/en/user-guide/cost-understanding-compute",
Which statement best describes `clustering`?,multiple-choice,A. Clustering represents the way data is grouped together and stored within Snowflake's micro-partitions,B. The database administrator must define the clustering methodology for each Snowflake table,C. The clustering key must be included on the COPY command when loading data into Snowflake,D. Clustering can be disabled within a Snowflake account,,,,,,,,,,,,1,"Strongly agree, A is the correct the correct answer.
https://docs.snowflake.com/en/user-guide/tables-clustering-micropartitions.html  In Snowflake, as data is inserted/loaded into a table, clustering metadata is collected and recorded for each micro-partition created during the process. Snowflake then leverages this clustering information to avoid unnecessary scanning of micro-partitions during querying, significantly accelerating the performance of queries that reference these columns.",
True or False: The COPY command must specify a File Format in order to execute.,multiple-choice,A. True,B. False,,,,,,,,,,,,,,2,"False.  In Snowflake, the COPY command does not necessarily require specifying a File Format in order to execute. The COPY command can be used to load data into a table from various file formats such as CSV, JSON, Avro, Parquet, etc.  When a file format is not explicitly specified in the COPY command, Snowflake attempts to automatically infer the file format based on the file's extension or internal file structure. This automatic file format inference feature is known as ""automatic file format detection.""  However, if the file format cannot be determined automatically or if you want to override the automatic detection, you can explicitly specify a File Format in the COPY command using the FILE_FORMAT parameter.  So, while specifying a File Format can provide more control and customization over the data loading process, it is not mandatory for the COPY command to execute successfully.
The correct answer is FALSE. The file format can be defined at the stage, table, or copy into command.  Create Stage: https://docs.snowflake.com/en/sql-reference/sql/create-stage.html Create Table (STAGE_FILE_FORMAT option): https://docs.snowflake.com/en/sql-reference/sql/create-table.html Copy Into: https://docs.snowflake.com/en/sql-reference/sql/copy-into-table.html",
Which of the following commands sets the Virtual Warehouse for a session?,multiple-choice,A. COPY WAREHOUSE FROM <<config file>>;,B. SET WAREHOUSE = <<warehouse name>>;,C. USE WAREHOUSE <<warehouse name>>;,D. USE VIRTUAL_WAREHOUSE <<warehouse name>>;,,,,,,,,,,,,3,"The correct answer is C. According to snowflake docs,   ""A Snowflake session can only have one current warehouse at a time. The current warehouse for a session can be specified or changed at any time through the USE WAREHOUSE command.""
https://docs.snowflake.com/en/user-guide/warehouses-tasks.html",
Which of the following objects can be cloned? (Choose four.),multi-select,A. Tables,B. Named File Formats,C. Schemas,D. Shares,E. Databases,F. Users,,,,,,,,,,"1, 2, 3, 5","ABCE : Shares and Users cannot be cloned in Snowflake because they represent different types of objects and have different purposes.  Shares represent shared access to data within Snowflake, and they cannot be cloned because access to data is controlled through the sharing mechanism, not through copying the share itself.  Users represent individual accounts within Snowflake, and they cannot be cloned because each user account must have a unique name and must be associated with a unique set of permissions. Cloning a user would result in two users with the same name, which is not allowed in Snowflake.  Instead of cloning Shares or Users, you can use the Snowflake GRANT command to manage access to data and permissions in Snowflake. The GRANT command allows you to control access to data by granting specific privileges to users, roles, or groups.
ABCE https://docs.snowflake.com/en/sql-reference/sql/create-clone",
Which object allows you to limit the number of credits consumed within a Snowflake account?,multiple-choice,A. Account Usage Tracking,B. Resource Monitor,C. Warehouse Limit Parameter,D. Credit Consumption Tracker,,,,,,,,,,,,2,"True B is correct
We can control and set the limit for credit usage in Resource Monitors. https://docs.snowflake.com/en/user-guide/resource-monitors.html#:~:text=To%20help%20control%20costs%20and%20avoid%20unexpected%20credit%20usage%20caused%20by%20running%20warehouses%2C%20Snowflake%20provides%20resource%20monitors",
Snowflake is designed for which type of workloads? (Choose two.),multi-select,A. OLAP (Analytics) workloads,B. OLTP (Transactional) workloads,C. Concurrent workloads,D. On-premise workloads,,,,,,,,,,,,"1, 3",Check this new feature of Unistore! A new workload that delivers a modern approach to working with transactional and analytical data together in a single platform https://www.snowflake.com/blog/introducing-unistore/,
What are the three layers that make up Snowflake's architecture? (Choose three.),multi-select,A. Compute,B. Tri-Secret Secure,C. Storage,D. Cloud Services,,,,,,,,,,,,"1, 3, 4","Snowflake architecture is made up of compute , storage and cloud services layer primarily.
https://docs.snowflake.com/en/user-guide/intro-key-concepts.html",
Why would a customer size a Virtual Warehouse from an X-Small to a Medium?,multiple-choice,A. To accommodate more queries,B. To accommodate more users,C. To accommodate fluctuations in workload,D. To accommodate a more complex workload,,,,,,,,,,,,4,"Answer is D. As you mention warehouse resizing is not intended for handling concurrency issues(i.e handling more queries). The solution for A would be multi-clustering.
A is the correct answer.  Ref: https://docs.snowflake.com/en/user-guide/warehouses-considerations.html  Resizing a warehouse generally improves query performance, particularly for larger, more complex queries. It can also help reduce the queuing that occurs if a warehouse does not have enough compute resources to process all the queries that are submitted concurrently. Note that warehouse resizing is not intended for handling concurrency issues; instead, use additional warehouses to handle the workload or use a multi-cluster warehouse (if this feature is available for your account).",
True or False: Reader Accounts incur no additional Compute costs to the Data Provider since they are simply reading the shared data without making changes.,multiple-choice,A. True,B. False,,,,,,,,,,,,,,2,False. https://docs.snowflake.com/en/user-guide/data-sharing-reader-create.html#:~:text=The%20reader%20account%20is%20created%2C%20owned%2C%20and%20managed%20by%20the%20provider%20account%2C%20which%20assumes%20all%20responsibility%20for%20credit%20charges%20incurred%20by%20users%20in%20the%20reader%20account.,
Which of the following connectors allow Multi-Factor Authentication (MFA) authorization when connecting? (Choose all that apply.),multi-select,A. JDBC,B. SnowSQL,C. Snowflake Web Interface (UI),D. ODBC,E. Python,,,,,,,,,,,"1, 2, 3, 4, 5","MFA login is designed primarily for connecting to Snowflake through the  - web interface - but is also fully-supported by SnowSQL - and the Snowflake JDBC and ODBC drivers. Snowflake supports MFA token caching with the following drivers and connectors on macOS and Windows. This feature is not supported on Linux. - ODBC driver version 2.23.0 (or later). - JDBC driver version 3.12.16 (or later). - Python Connector for Snowflake version 2.3.7 (or later).
https://docs.snowflake.com/en/user-guide/security-mfa",
True or False: Snowflake charges a premium for storing semi-structured data.,multiple-choice,A. True,B. False,,,,,,,,,,,,,,2,"Snowflake does not charge extra for any special/semi-structure type of file.
https://snowflakecommunity.force.com/s/question/0D50Z00008ckwNuSAI/does-snowflake-charges-premium-for-storing-semi-structured-data",
Which of the following statements describes a benefit of Snowflake's separation of compute and storage? (Choose all that apply.),multi-select,A. Growth of storage and compute are tightly coupled together,B. Storage expands without the requirement to add more compute,C. Compute can be scaled up or down without the requirement to add more storage,D. Multiple compute clusters can access stored data without contention,,,,,,,,,,,,"2, 3, 4","BCD, all the three are correct
",
True or False: It is possible to unload structured data to semi-structured formats such as JSON and Parquet.,multiple-choice,A. True,B. False,,,,,,,,,,,,,,1,"A is the correct answer
A is correct: https://docs.snowflake.com/en/user-guide/data-unload-considerations.html#unloading-a-relational-table-to-json",
In which layer of its architecture does Snowflake store its metadata statistics?,multiple-choice,A. Storage Layer,B. Compute Layer,C. Database Layer,D. Cloud Services Layer,,,,,,,,,,,,3,"Cloud Service layer stores metadata of queries for optimization.
Correct answer should be ""C"".  https://docs.snowflake.com/en/user-guide/intro-key-concepts Database Storage¶ When data is loaded into Snowflake, Snowflake reorganizes that data into its internal optimized, compressed, columnar format. Snowflake stores this optimized data in cloud storage.  Snowflake manages all aspects of how this data is stored — the organization, file size, structure, compression, metadata, statistics, and other aspects of data storage are handled by Snowflake. The data objects stored by Snowflake are not directly visible nor accessible by customers; they are only accessible through SQL query operations run using Snowflake. 
Database Storage

When data is loaded into Snowflake, Snowflake reorganizes that data into its internal optimized, compressed, columnar format. Snowflake stores this optimized data in cloud storage.

Snowflake manages all aspects of how this data is stored — the organization, file size, structure, compression, metadata, statistics, and other aspects of data storage are handled by Snowflake. The data objects stored by Snowflake are not directly visible nor accessible by customers; they are only accessible through SQL query operations run using Snowflake.",
True or False: Data in fail-safe can be deleted by a user or the Snowflake team before it expires.,multiple-choice,A. True,B. False,,,,,,,,,,,,,,2,"Fail Safe can not be configured. Users, neither retrieve nor delete the data of fail safe.
https://blog.knoldus.com/ksnow-time-travel-and-fail-safe-in-snowflake/",
"True or False: Snowflake's data warehouse was built from the ground up for the cloud in lieu of using an existing database or a platform, like Hadoop, as a base.",multiple-choice,A. True,B. False,,,,,,,,,,,,,,2,https://docs.snowflake.com/en/user-guide/intro-key-concepts#:~:text=The%20Snowflake%20data%20platform%20is%20not%20built%20on%20any%20existing%20database%20technology%20or%20%E2%80%9Cbig%20data%E2%80%9D%20software%20platforms%20such%20as%20Hadoop.%20Instead%2C%20Snowflake%20combines%20a%20completely%20new%20SQL%20query%20engine%20with%20an%20innovative%20architecture%20natively%20designed%20for%20the%20cloud.   Answer is False.,
Which of the following statements are true of Virtual Warehouses? (Choose all that apply.),multi-select,A. Customers can change the size of the Warehouse after creation,B. A Warehouse can be resized while running,C. A Warehouse can be configured to suspend after a period of inactivity,D. A Warehouse can be configured to auto-resume when new queries are submitted,,,,,,,,,,,,"1, 2, 3, 4","All four are true  Additionally, multi-cluster warehouses support all the same properties and actions as single-cluster warehouses, including:  1)Specifying a warehouse size. 2)Resizing a warehouse at any time. 3)Auto-suspending a running warehouse due to inactivity; note that this does not apply to individual clusters, but rather the entire multi-cluster warehouse. 4)Auto-resuming a suspended warehouse when new queries are submitted.
https://docs.snowflake.com/en/user-guide/warehouses-multicluster.html",
The PUT command: (Choose two.),multi-select,A. Automatically creates a File Format object,B. Automatically uses the last Stage created,C. Automatically compresses files using Gzip,D. Automatically encrypts files,,,,,,,,,,,,"2, 4","First we will create a stage and then use PUT to load the data from onprem to that stage. Hence B. And the data will be transferred to the stage and will be encrypted, Hence D. So I guess it should be B and D.
Uploaded files are automatically encrypted with 128-bit or 256-bit keys.  AUTO_COMPRESS is TRUE by default and by default it uses GZIP.  https://docs.snowflake.com/en/sql-reference/sql/put.html",
Which type of table corresponds to a single Snowflake session?,multiple-choice,A. Temporary,B. Transient,C. Provisional,D. Permanent,,,,,,,,,,,,1,"Temporary tables are created in a session and they cannot be accessed through different session.
Temporary tables only exist within the session in which they were created and persist only for the remainder of the session. https://docs.snowflake.com/en/user-guide/tables-temp-transient.html#temporary-tables",
Which interfaces can be used to create and/or manage Virtual Warehouses?,multiple-choice,A. The Snowflake Web Interface (UI),B. SQL commands,C. Data integration tools,D. All of the above,,,,,,,,,,,,4,"The correct answer is D. All of the above.  Virtual Warehouses can be created and/or managed using the Snowflake Web Interface (UI), SQL commands, or data integration tools.  The Snowflake Web Interface (UI) is a graphical user interface that allows users to create and manage Virtual Warehouses. The Snowflake Web Interface (UI) is available in both a web browser and a mobile app.  SQL commands can be used to create and manage Virtual Warehouses. SQL commands can be executed using the Snowflake Web Interface (UI), the Snowflake Command Line Interface (CLI), or a data integration tool.  Data integration tools can be used to create and manage Virtual Warehouses. Data integration tools are software applications that allow users to extract, transform, and load data from a variety of sources into Snowflake.
https://docs.snowflake.com/en/user-guide/intro-key-concepts.html  A warehouse can be created through the web interface or using SQL:  Classic Web Interface Click on Warehouses Warehouses tab » Create  SQL Execute a CREATE WAREHOUSE command.",
When a Pipe is recreated using the CREATE OR REPLACE PIPE command:,multiple-choice,A. The Pipe load history is reset to empty,B. The REFRESH parameter is set to TRUE,C. Previously loaded files will be ignored,D. All of the above,,,,,,,,,,,,4,"D is correct  Recreating Pipes - Load History:(As per documentation) The load history for Snowpipe operations is stored in the metadata of the pipe object. When a pipe is recreated, the load history is dropped. In general, this condition only affects users if they subsequently execute an ALTER PIPE … REFRESH statement on the pipe. Doing so could load duplicate data from staged files in the storage location for the pipe if the data was already loaded successfully and the files were not deleted subsequently.  https://docs.snowflake.com/en/user-guide/data-load-snowpipe-manage#label-snowpipe-management-recreate-pipes",
What is the minimum Snowflake edition that customers planning on storing protected information in Snowflake should consider for regulatory compliance?,multiple-choice,A. Standard,B. Premier,C. Enterprise,D. Business Critical Edition,,,,,,,,,,,,3,"C. Enterprise Edition.  The Enterprise Edition of Snowflake offers advanced security features and capabilities that are designed to meet the stringent requirements of regulatory compliance. It includes features such as role-based access control (RBAC), encryption at rest and in transit, audit logging, fine-grained access controls, and data masking. These features help ensure the security and compliance of sensitive and protected data stored in Snowflake.  While other editions of Snowflake, such as Standard and Premier, also provide security features, the Enterprise Edition is specifically tailored for organizations with higher compliance and security requirements. It offers additional features and capabilities that address the needs of regulated industries and data protection standards.  Therefore, customers planning on storing protected information in Snowflake for regulatory compliance should consider the Enterprise Edition as a suitable option.
PII and HIPAA compliance are only supported for Business Critical Edition or higher. But the question should have been more specific as jjordan mentioned. https://docs.snowflake.com/en/user-guide/intro-editions.html#security-governance-data-protection",
Select the three types of tables that exist within Snowflake. (Choose three.),multi-select,A. Temporary,B. Transient,C. Provisional,D. Permanent,,,,,,,,,,,,"1, 2, 4","Temporary tables, Transient tables, Permanent tables exists in Snowflake.
https://community.snowflake.com/s/article/Making-Transient-table-by-Default",
True or False: Snowpipe via REST API can only reference External Stages as source.,multiple-choice,A. True,B. False,,,,,,,,,,,,,,2,"https://docs.snowflake.com/en/user-guide/data-load-snowpipe-rest-load B)  Stage your data files:  Internal stage: Use the PUT command to stage your files.  External stage: Use the client tools provided by the cloud provider to copy your files to the stage location (Amazon S3, Google Cloud Storage, or Microsoft Azure).",
True or False: A third-party tool that supports standard JDBC or ODBC but has no Snowflake-specific driver will be unable to connect to Snowflake.,multiple-choice,A. True,B. False,,,,,,,,,,,,,,2,"False.  A third-party tool that supports standard JDBC or ODBC can connect to Snowflake even without a Snowflake-specific driver. Snowflake provides JDBC and ODBC connectors that adhere to the standard JDBC and ODBC interfaces, allowing third-party tools to establish a connection to Snowflake using these standard protocols.  The Snowflake JDBC and ODBC connectors act as bridges between the third-party tools and the Snowflake service, enabling communication and data exchange. As long as the third-party tool supports JDBC or ODBC, it can utilize the Snowflake connectors to connect to Snowflake and interact with the data warehouse.  This approach ensures compatibility and interoperability with a wide range of tools and applications that support JDBC or ODBC, making it easier to integrate Snowflake into existing ecosystems or use preferred third-party tools for data analysis, reporting, or other purposes.
Answer is B False:  E.g. JDBC:  https://docs.snowflake.com/en/user-guide/jdbc.html  Snowflake provides a JDBC type 4 driver that supports core JDBC functionality. The JDBC driver must be installed in a 64-bit environment and requires Java 1.8 (or higher). The driver can be used with most client tools/applications that support JDBC for connecting to a database server.",
True or False: It is possible to load data into Snowflake without creating a named File Format object.,multiple-choice,A. True,B. False,,,,,,,,,,,,,,1,"True. Snowflake supports loading data without creating a named File Format object. Snowflake provides built-in file formats that can be used to load data without the need to create a file format object explicitly.  For example, to load a CSV file, you can use the built-in CSV file format by simply specifying the FILE_FORMAT option as CSV in the COPY INTO command. This allows you to quickly load data without the overhead of creating a named file format object.       Send a message...
https://docs.snowflake.com/en/user-guide/data-load-external-tutorial-create-file-format",
True or False: A table in Snowflake can only be queried using the Virtual Warehouse that was used to load the data.,multiple-choice,A. True,B. False,,,,,,,,,,,,,,2,"B is correct. you can query cached data without having virtual warehouse running
",
