Which of the following operations require the use of a running virtual warehouse? (Choose two.),multi-select,A. Downloading data from an internal stage,B. Listing files in a stage,C. Executing a stored procedure,D. Altering a table,E. Querying data from a materialized view,,,,,,,,,,,"3, 5","Performing DML operations, such as: Updating rows in tables (DELETE , INSERT , UPDATE). (Answer D) Loading data into tables (COPY INTO <table>). Unloading data from tables (COPY INTO <location>). (Answer A) a warehouse must be running and in use for the session.
C & E https://docs.snowflake.com/en/user-guide/warehouses.html",
What is used to limit the credit usage of a virtual warehouse within a Snowflake account?,multiple-choice,A. Load monitor,B. Resource monitor,C. Query Profile,D. Stream,,,,,,,,,,,,2,"ressource monitor of course
https://docs.snowflake.com/en/user-guide/resource-monitors.html#:~:text=A%20resource%20monitor%20can%20be,and%20how%20long%20it%20runs.",
What are the benefits of the replication feature in Snowflake? (Choose two.),multi-select,A. Disaster recovery,B. Time Travel,C. Fail-safe,D. Database failover and failback,E. Data security,,,,,,,,,,,"1, 4","Replication is not a security model infact it increases risk exposure, its for business continuity.
https://www.snowflake.com/trending/what-is-data-replication#:~:text=DATABASE%20REPLICATION%20SOLUTIONS&text=Customers%20using%20Snowflake%20Standard%20edition,portability%20to%20facilitate%20account%20migrations  so I think D and E are correct",
Which data type can be used to store geospatial data in Snowflake?,multiple-choice,A. Variant,B. Object,C. Geometry,D. Geography,,,,,,,,,,,,4,"Snowflake provides the following data types for geospatial data: The GEOGRAPHY data type, which models Earth as though it were a perfect sphere. The GEOMETRY data type, which represents features in a planar (Euclidean, Cartesian) coordinate system.
",
"If all virtual warehouse resources are maximized while processing a query workload, what will happen to new queries that are submitted to the warehouse?",multiple-choice,A. All queries will terminate when the resources are maximized.,B. The warehouse will scale out automatically,C. The warehouse will move to a suspended state.,D. New queries will be queued and executed when capacity is available.,,,,,,,,,,,,4,"D is correct
",
Masking policies can be applied to which of the following Snowflake objects? (Choose two.),multi-select,A. A materialized view,B. A stored procedure,C. A table,D. A stream,"E. A pipe -
E. A User-Defined Function (UDF)",,,,,,,,,,,"1, 3","A&C I think
",
What actions are supported by Snowflake resource monitors? (Choose two.),multi-select,A. Alert,B. Notify,C. Notify and suspend,D. Abort,E. Suspend immediately,,,,,,,,,,,"1, 3","B&C https://docs.snowflake.com/en/user-guide/resource-monitors.html#actions Notify & Suspend Notify & Suspend Immediately Notify
",
"A user executes the following SQL query:

create table SALES_BKP like SALES;

What are the cost implications for processing this query?",multiple-choice,A. Processing costs will be generated based on how long the query takes.,B. Storage costs will be generated based on the size of the data.,C. No costs will be incurred as the query will use metadata.,D. The cost for running the virtual warehouse will be charged by the second.,,,,,,,,,,,,3,"C is right.
",
What is the maximum length of time travel available in the Snowflake Standard Edition?,multiple-choice,A. 1 Day,B. 7 Days,C. 30 Days,D. 90 Days,,,,,,,,,,,,1,"Only 1 day
",
What happens when an external or an internal stage is dropped? (Choose two.),multi-select,"A. When dropping an external stage, the files are not removed and only the stage is dropped.","B. When dropping an external stage, both the stage and the files within the stage are removed.","C. When dropping an internal stage, the files are deleted with the stage and the files are recoverable.","D. When dropping an internal stage, the files are deleted with the stage and the files are not recoverable.","E. When dropping an internal stage, only selected files are deleted with the stage and are not recoverable.",,,,,,,,,,,"1, 4","per the docs explain
",
"A user has 10 files in a stage containing new customer data. The ingest operation completes with no errors, using the following command:

COPY INTO my_table FROM @my_stage;

The next day the user adds 10 files to the stage so that now the stage contains a mixture of new customer data and updates to the previous data. The user did not remove the 10 original files.

If the user runs the same COPY INTO command what will happen?",multiple-choice,A. All data from all of the files on the stage will be appended to the table.,B. Only data about new customers from the new files will be appended to the table.,C. The operation will fail with the error UNCERTAIN FILES IN STAGE.,D. All data from only the newly-added files will be appended to the table.,,,,,,,,,,,,4,"D - only the new files will be appended B - SF doesn't know which customer is new (COPY doesn't care about the meaning of data, care about files (file names) which are new (no kept in metadata as loaded)
",
Which parameter can be used to instruct a COPY command to verify data files instead of loading them into a specified table?,multiple-choice,A. STRIP_NULL_VALUES,B. SKIP_BYTE_ORDER_MARK,C. REPLACE_INVALID_CHARACTERS,D. VALIDATION_MODE,,,,,,,,,,,,4,"VALIDATION_MODE: This instructs the command to validate the data files instead of loading them into target tables and allows you to perform the dry run to ensure the fail-safe delivery of data.Dec
",
Which of the following SQL statements will list the version of the drivers currently being used?,multiple-choice,A. Execute SELECT CURRENT_ODBC_CLIENT(); from the Web UI,B. Execute SELECT CURRENT_JDBC_VERSION(); from SnowSQL,C. Execute SELECT CURRENT_CLIENT(); from an application,D. Execute SELECT CURRENT_VERSION(); from the Python Connector,,,,,,,,,,,,3,"C is the correct answer. Just checked it.
",
Which Snowflake technique can be used to improve the performance of a query?,multiple-choice,A. Clustering,B. Indexing,C. Fragmenting,D. Using INDEX_HINTS,,,,,,,,,,,,1,"Answer A , Clustering
",
"What happens to the shared objects for users in a consumer account from a share, once a database has been created in that account?",multiple-choice,A. The shared objects are transferred.,B. The shared objects are copied.,C. The shared objects become accessible.,D. The shared objects can be re-shared.,,,,,,,,,,,,3,"Database become accessible
",
Using variables in Snowflake is denoted by using which SQL character?,multiple-choice,A. @,B. &,C. $,D. #,,,,,,,,,,,,3,"Selected Answer: C
",
Which commands should be used to grant the privilege allowing a role to select data from all current tables and any tables that will be created later in a schema? (Choose two.),multi-select,A. grant USAGE on all tables in schema DB1.SCHEMA to role MYROLE;,B. grant USAGE on future tables in schema DB1.SCHEMA to role MYROLE;,C. grant SELECT on all tables in schema DB1.SCHEMA to role MYROLE;,D. grant SELECT on future tables in schema DB1.SCHEMA to role MYROLE;,E. grant SELECT on all tables in database DB1 to role MYROLE;,F. grant SELECT on future tables in database DB1 to role MYROLE;,,,,,,,,,,"3, 4","Changing to C,D
",
How can a user change which columns are referenced in a view?,multiple-choice,A. Modify the columns in the underlying table,B. Use the ALTER VIEW command to update the view,C. Recreate the view with the required changes,D. Materialize the view to perform the changes,,,,,,,,,,,,3,"Answer is C: https://docs.snowflake.com/en/sql-reference/sql/alter-view.html#alter-view
",
Which statement describes pruning?,multiple-choice,A. The filtering or disregarding of micro-partitions that are not needed to return a query.,B. The return of micro-partitions values that overlap with each other to reduce a query's runtime.,C. A service that is handled by the Snowflake Cloud Services layer to optimize caching.,D. The ability to allow the result of a query to be accessed as if it were a table.,,,,,,,,,,,,1,"A is correct
",
What do temporary and transient tables have in common in Snowflake? (Choose two.),multi-select,A. Both tables have no Fail-safe period.,B. Both tables have data retention period maximums of one day.,C. Both tables are visible only to a single user session.,"D. For both tables, the retention period ends when the tables are dropped.","E. For both tables, the retention period does not end when the session ends.",,,,,,,,,,,"1, 2","A and B are correct.  https://docs.snowflake.com/user-guide/tables-temp-transient#comparison-of-table-types
B is correct too https://docs.snowflake.com/en/user-guide/tables-temp-transient#comparison-of-table-types",
What are the least privileges needed to view and modify resource monitors? (Choose two.),multi-select,A. SELECT,B. OWNERSHIP,C. MONITOR,D. MODIFY,E. USAGE,,,,,,,,,,,"3, 4","CD is correct  https://docs.snowflake.com/en/user-guide/resource-monitors
CD is correct   roles that have been granted the following privileges on specific resource monitors can view and modify the resource monitor as needed using SQL:  - MONITOR - MODIFY  https://docs.snowflake.com/en/user-guide/resource-monitors",
When does a materialized view get suspended in Snowflake?,multiple-choice,A. When a column is added to the base table,B. When a column is dropped from the base table,C. When a DML operation is run on the base table,D. When the base table is reclustered,,,,,,,,,,,,2,"https://docs.snowflake.com/en/user-guide/views-materialized#dropping-the-base-table
B (""If a base table is altered so that existing columns are changed or dropped, then all materialized views on that base table are suspended; the materialized views cannot be used or maintained. (This is true even if the modified or dropped column was not part of the materialized view.)"")",
What happens when a Snowflake user changes the data retention period at the schema level?,multiple-choice,A. All child objects will retain data for the new retention period.,B. All child objects that do not have an explicit retention period will automatically inherit the new retention period.,C. All child objects with an explicit retention period will be overridden with the new retention period.,D. All explicit child object retention periods will remain unchanged.,,,,,,,,,,,,2,"BD are correct
Also D is correct. But B includes D, since just one answer is requested, B is the one
Correct answer is B.  -------------------------------------------------------- If you change the data retention period for a database or schema, the change only affects active objects contained within the database or schema. Any objects that have been dropped (for example, tables) remain unaffected.  For example, if you have a schema s1 with a 90-day retention period and table t1 is in schema s1, table t1 inherits the 90-day retention period. If you drop table s1.t1, t1 is retained in Time Travel for 90 days. Later, if you change the schema’s data retention period to 1 day, the retention period for the dropped table t1 is unchanged. Table t1 will still be retained in Time Travel for 90 days. -------------------------------------------------------- https://docs.snowflake.com/en/user-guide/data-time-travel#specifying-the-data-retention-period-for-an-object:~:text=through%20Time%20Travel.-,Note,-If%20you%20change
BD are both correct, confirmed by testing below. https://docs.snowflake.com/en/user-guide/data-time-travel -- 902  USE ROLE SYSADMIN; CREATE DATABASE TIME_TRAVEL_TEST; USE SCHEMA PUBLIC; CREATE TABLE T_A AS SELECT 1 ID; CREATE TABLE T_B AS SELECT 2 ID;  ALTER TABLE T_B SET DATA_RETENTION_TIME_IN_DAYS=90;  ALTER SCHEMA PUBLIC SET DATA_RETENTION_TIME_IN_DAYS=30;  -- PUBLIC - explicitly set at 30   --T_A - not set explicitly, but was inherited from parent   --T_B - explicitly set at 90  SHOW PARAMETERS like '%DATA_RETENTION_TIME_IN_DAYS%' in schema PUBLIC; --30 SHOW PARAMETERS like '%DATA_RETENTION_TIME_IN_DAYS%' in table T_A; --30 inherited from parent  SHOW PARAMETERS like '%DATA_RETENTION_TIME_IN_DAYS%' in table T_B; --90 remained explicitly set",
Snowpark provides libraries for which programming languages? (Choose two.),multi-select,A. JavaScript,B. Python,C. Scala,D. R,E. C++,,,,,,,,,,,"2, 3","BC is correct.  Snowpark provide libs for Java  Python Scala https://docs.snowflake.com/en/developer-guide/snowpark/index#developer-guides
Confirmed, BC",
How can a Snowflake user sample 10 rows from a table named SNOWPRO? (Choose two.),multi-select,A. SELECT * FROM SNOWPRO SAMPLE SYSTEM (10),B. SELECT * FROM SNOWPRO TABLESAMPLE (10 ROWS),C. SELECT * FROM SNOWPRO TABLESAMPLE BLOCK (10),D. SELECT * FROM SNOWPRO TABLESAMPLE BLOCK (10 ROWS),E. SELECT * FROM SNOWPRO SAMPLE BERNOULLI (10 ROWS),,,,,,,,,,,"2, 5","SELECT COUNT(*) FROM SNOWFLAKE_SAMPLE_DATA.TPCDS_SF100TCL.CALL_CENTER; --60  -- A - not correct -- showing different results each time   -- 5, 8, 7 SELECT COUNT(*) FROM SNOWFLAKE_SAMPLE_DATA.TPCDS_SF100TCL.CALL_CENTER TABLESAMPLE SYSTEM (10);  -- B - correct --10 SELECT COUNT(*) FROM SNOWFLAKE_SAMPLE_DATA.TPCDS_SF100TCL.CALL_CENTER TABLESAMPLE (10 ROWS);   -- C - not correct --9,6,11 SELECT COUNT(*) FROM SNOWFLAKE_SAMPLE_DATA.TPCDS_SF100TCL.CALL_CENTER TABLESAMPLE BLOCK (10);   -- D - not working --Sampling with a fixed size does not support using block sampling method. SELECT COUNT(*) FROM SNOWFLAKE_SAMPLE_DATA.TPCDS_SF100TCL.CALL_CENTER TABLESAMPLE BLOCK (10 ROWS);   -- E - correct -- 10 SELECT COUNT(*) FROM SNOWFLAKE_SAMPLE_DATA.TPCDS_SF100TCL.CALL_CENTER TABLESAMPLE BERNOULLI (10 ROWS);
BE is the correct answer. System or Block do not support fixed rows.  https://docs.snowflake.com/en/sql-reference/constructs/sample#:~:text=BERNOULLI%20%7C%20ROW%20or%20SYSTEM%20%7C%20BLOCK",
Why would a Snowflake user choose to use a transient table?,multiple-choice,A. To store data for long-term analysis,B. To store large data files that are used frequently,C. To create a permanent table for ongoing use in ELT,D. To store transitory data that needs to be maintained beyond the session,,,,,,,,,,,,4,"D is the correct answer.  transient tables are specifically designed for transitory data that needs to be maintained beyond each session https://docs.snowflake.com/en/user-guide/tables-temp-transient#transient-tables
D is correct",
What does a masking policy consist of in Snowflake?,multiple-choice,"A. A single data type, with one or more conditions, and one or more masking functions","B. A single data type, with only one condition, and only one masking function","C. Multiple data types, with only one condition, and one or more masking functions","D. Multiple data types, with one or more conditions, and one or more masking functions",,,,,,,,,,,,1,"A ""A masking policy consists of a single data type, one or more conditions, and one or more masking functions."" https://docs.snowflake.com/en/user-guide/security-column-intro
A masking policy consists of a single data type, one or more conditions, and one or more masking functions",
What actions can be performed by a consumer account on a shared database? (Choose two.),multi-select,A. Cloning a shared table,B. Modifying the data in a shared table,C. Using Time Travel on a shared table,D. Executing the SELECT statement on a shared table,E. Joining the data from a shared table with another table,,,,,,,,,,,"4, 5","Agreed
DE is right
DE is correct",
What data type is used to ingest semi-structured data into a Snowflake table?,multiple-choice,A. BOOLEAN,B. NUMBER,C. VARBINARY,D. VARIANT,,,,,,,,,,,,4,D is correct,
Which security feature is used to connect or log in to a Snowflake account?,multiple-choice,A. Network policy,B. SCIM,C. Role-Based Access Control (RBAC),D. Key pair authentication,,,,,,,,,,,,4,"D. https://docs.snowflake.com/en/user-guide/key-pair-auth
D is correct
correct answer B - https://docs.snowflake.com/en/user-guide/scim-intro",
Which Snowflake feature or tool helps troubleshoot issues in SQL query expressions that commonly cause performance bottlenecks?,multiple-choice,A. Persisted query results,B. QUERY_HISTORY view,C. Query acceleration service,D. Query Profile,,,,,,,,,,,,4,"Analyze and optimize SQL queries by examining execution plans and identifying potential bottlenecks. Use Snowflake's query profiling tools to understand query performance characteristics and optimize accordingly. Consider breaking down complex queries into smaller, more manageable steps to improve performance. https://www.linkedin.com/advice/1/how-can-you-optimize-performance-snowflake-data-5jhec
Correct Answer : D",
What is a non-configurable feature that provides historical data that Snowflake may recover during a 7-day period?,multiple-choice,A. Fail-safe,B. Time Travel,C. Cloning,D. Account replication,,,,,,,,,,,,1,"Fail-safe
correct Answer - A",
Which function should be used to authorize users to access rows in a base table when using secure views with Secure Data Sharing?,multiple-choice,A. CURRENT_ACCOUNT(),B. CURRENT_ROLE(),C. CURRENT_SESSION(),D. CURRENT_USER(),,,,,,,,,,,,1,"The correct answer is A. CURRENT_ACCOUNT()  Secure Views and Data Sharing When using secure views with Secure Data Sharing, use the CURRENT_ACCOUNT function to authorize users from a specific account to access rows in a base table. ------------------------------------------------------------------------------------------------------------------------------- Note: When using the CURRENT_ROLE and CURRENT_USER functions with secure views that will be shared to other Snowflake accounts, Snowflake returns a NULL value for these functions. The reason is that the owner of the data being shared does not typically control the users or roles in the account with which the view is being shared.  https://docs.snowflake.com/en/user-guide/views-secure#secure-views-and-data-sharing
https://docs.snowflake.com/en/user-guide/views-secure#secure-views-and-data-sharing",
What is the purpose of collecting statistics on data in Snowflake?,multiple-choice,A. To identify data storage order correlations,B. To enable efficient pruning based on query filters,C. To reduce the total number of micro-partitions in a table,D. To optimize query performance by reading all data in a table,,,,,,,,,,,,2,B. Stats help with partition pruning telling optimizer what micro-partitions to skip.,
What type of function returns one value for each invocation?,multiple-choice,A. Aggregate,B. Scalar,C. Table,D. Window,,,,,,,,,,,,2,"A scalar function is a function that returns one value per invocation; in most cases, you can think of this as returning one value per row. This contrasts with Aggregate Functions, which return one value per group of rows.
B is correct  https://docs.snowflake.com/en/sql-reference/functions",
Which file formats support unloading semi-structured data? (Choose two.),multi-select,A. Avro,B. JSON,C. ORC,D. Parquet,E. XML,,,,,,,,,,,"2, 4","https://docs.snowflake.com/en/user-guide/data-unload-prepare The following file formats are supported: Semi-structured JSON, Parquet
Correct
Snowflake provides built-in support for importing data from (and exporting data to) the following semi-structured data formats:  -JSON -Avro -ORC -Parquet -XML  https://docs.snowflake.com/en/user-guide/semistructured-concepts",
Which system-defined Snowflake role has permission to rename an account and specify whether the original URL can be used to access the renamed account?,multiple-choice,A. ACCOUNTADMIN,B. SECURITYADMIN,C. SYSADMIN,D. ORGADMIN,,,,,,,,,,,,4,"Allows organization administrators (that is, users with the ORGADMIN role) to modify core characteristics of an account. For example, the organization administrator can rename an account. ALTER ACCOUNT <name> RENAME TO <new_name> [ SAVE_OLD_URL = { TRUE | FALSE } ]
D is correct
https://docs.snowflake.com/en/sql-reference/sql/alter-account  Organization administrators (i.e. users with the ORGADMIN role) to: Rename an account and specify whether the original URL can be used to access the account.
Answer- D https://docs.snowflake.com/en/sql-reference/sql/alter-account",
How can a user get the MOST detailed information about individual table storage details in Snowflake?,multiple-choice,A. SHOW TABLES command,B. SHOW EXTERNAL TABLES command,C. TABLES view,D. TABLE_STORAGE_METRICS view,,,,,,,,,,,,4,"D - table_storage_metrics view
it's correct. https://docs.snowflake.com/en/sql-reference/account-usage/table_storage_metrics",
What type of account can be used to share data with a consumer who does not have a Snowflake account?,multiple-choice,A. Data provider,B. Data consumer,C. Reader,D. Organization,,,,,,,,,,,,3,"As a data provider, you might want to share data with a consumer who does not already have a Snowflake account or is not ready to become a licensed Snowflake customer.  To facilitate sharing data with these consumers, you can create reader accounts. Reader accounts (formerly known as “read-only accounts”) provide a quick, easy, and cost-effective way to share data without requiring the consumer to become a Snowflake customer.
Selected Answer: C Reader Account
https://docs.snowflake.com/en/user-guide/data-sharing-intro",
"By default, which role has access to the SYSTEM$GLOBAL_ACCOUNT_SET_PARAMETER function?",multiple-choice,A. ACCOUNTADMIN,B. SECURITYADMIN,C. SYSADMIN,D. ORGADMIN,,,,,,,,,,,,4,"The function enables replication and failover features for a specified account in an organization.  Once an organization administrator (a user with the ORGADMIN role) has called this function,   the following features are enabled for the account:  Replication  Client Redirect
https://docs.snowflake.com/en/sql-reference/functions/system_global_account_set_parameter  Only organization administrators (i.e. users with the ORGADMIN role) can call this SQL function.",
"If a virtual warehouse is suspended, what happens to the warehouse cache?",multiple-choice,A. The cache is dropped when the warehouse is suspended and is no longer available upon restart.,"B. The warehouse cache persists for as long as the warehouse exists, regardless of its suspension status.",C. The cache is maintained for up to two hours and can be restored if the warehouse is restarted within this limit.,D. The cache is maintained for the auto_suspend duration and can be restored if the warehouse is restarted within this limit.,,,,,,,,,,,,1,"Agreed
A is correct
https://docs.snowflake.com/en/user-guide/warehouses-considerations This cache is dropped when the warehouse is suspended, which may result in slower initial performance for some queries after the warehouse is resumed.  https://docs.snowflake.com/en/user-guide/performance-query-warehouse-cache The auto-suspension setting of the warehouse can have a direct impact on query performance because the cache is dropped when the warehouse is suspended.",
What are the primary authentication methods that Snowflake supports for securing REST API interactions? (Choose two.),multi-select,A. OAuth,B. Key pair authentication,C. Federated authentication,D. Multi-Factor Authentication (MFA),E. Username and password authentication,,,,,,,,,,,"1, 5","""Snowflake supports basic authentication (i.e. username and password) in the API request header as specified in RFC 7617, where the authentication credentials are encoded using Base64. Similarly, Snowflake supports OAuth 2.0 as specified in RFC 6749.""
https://docs.snowflake.com/en/user-guide/api-authentication
A, E https://docs.snowflake.com/en/user-guide/api-authentication",
"A Snowflake user is trying to load a 125 GB file using SnowSQL. The file continues to load for almost an entire day.

What will happen at the 24-hour mark?",multiple-choice,A. The file will continue to load until all contents are loaded.,B. The file will stop loading and all data up to that point will be committed.,C. The file loading could be aborted without any portion of the file being committed.,D. The file’s number of allowable hours to load can be programmatically controlled to load easily into Snowflake.,,,,,,,,,,,,3,"https://docs.snowflake.com/en/user-guide/data-load-considerations-prepare Note Loading very large files (e.g. 100 GB or larger) is not recommended.  If you must load a large file, carefully consider the ON_ERROR copy option value. Aborting or skipping a file due to a small number of errors could result in delays and wasted credits. In addition, if a data loading operation continues beyond the maximum allowed duration of 24 hours, it could be aborted without any portion of the file being committed. https://docs.snowflake.com/en/user-guide/data-load-considerations-prepare
https://docs.snowflake.com/en/user-guide/data-load-considerations-prepare",
What information does the Query Profile provide?,multiple-choice,A. Graphical representation of the data model,B. Statistics for each component of the processing plan,C. Detailed information about the database schema,D. Real-time monitoring of the database operations,,,,,,,,,,,,2,"The Snowflake query profile provides execution details for a query, offering a graphical representation of the processing plan's components, along with statistics for each component and the overall query.
The correct answer is B",
Which sequence (order) of object privileges should be used to grant a custom role read-only access on a table?,multiple-choice,A.,B.,C.,D.,,,,,,,,,,,,3,"In Snowflake, the USAGE privilege alone does not grant read-only access to a table. The USAGE privilege allows a role to see the database and schema, but it does not provide access to the data within the tables.  To grant read-only access to a table, you need to combine the USAGE privilege with the SELECT privilege. Here’s how you can do it:
Answer- C",
